{
  "name": "Juice",
  "birth_certificate_name": {
    "first": "Zachary",
    "last": "Ryan"
  },
  "emoji": "ðŸ§ƒ",
  "marching": {
    "years_marched": [2020]
  },
  "education": {
    "major": "Unmanned Aerial Systems",
    "year": "freshman"
  },
  "hometown": {
    "city": "Charlotte",
    "state": "North Carolina"
  }
}
