{
  "name": "Juggs",
  "birth_certificate_name": {
    "first": "Ben",
    "last": "Guzek"
  },
  "emoji": "üè∫",
  "marching": {
    "years_marched": [2015, 2016, 2017, 2018],
    "shoutout": "https://www.instagram.com/p/BnmGLkQHkuC/"
  },
  "education": {
    "major": "Business Management",
    "year": "alumni"
  },
  "hometown": {
    "city": "Schererville",
    "state": "Indiana"
  },
  "personal": {
    "hobbies": [
      "supporting the cubs",
      "reading/writing",
      "spending time with his friends and family"
    ]
  },
  "achievements": {
    "student_leader": [2017, 2018]
  }
}
