{
  "name": "Crabcakes",
  "birth_certificate_name": {
    "first": "John",
    "last": "Muhl"
  },
  "emoji": "ðŸ¦€",
  "marching": {
    "years_marched": [2020],
    "shoutout": "https://www.instagram.com/p/CIBbgvMFjWo/"
  },
  "education": {
    "major": "Engineering",
    "year": "freshman"
  },
  "hometown": {
    "city": "Dayton",
    "state": "Ohio"
  },
  "personal": {
    "hobbies": [
      "hanging out with friends",
      "watching movies",
      "playing video games",
      "reading"
    ]
  }
}
