{
  "name": "Shirt",
  "birth_certificate_name": {
    "first": "Shawn",
    "last": "Belongia"
  },
  "emoji": "ðŸ‘š",
  "marching": {
    "years_marched": [2020],
    "shoutout": "https://www.instagram.com/p/CGU_r0Cpet5/"
  },
  "education": {
    "major": "Engineering",
    "year": "freshman"
  },
  "hometown": {
    "city": "North Andover",
    "state": "Massachusetts"
  },
  "personal": {
    "hobbies": [
      "hiking and running outside",
      "listening to music (especially the oldies)"
    ]
  }
}
