{
  "name": "Frat Boy (AT&T)",
  "birth_certificate_name": {
    "first": "unknown",
    "last": "unknown"
  },
  "emoji": "",
  "marching": {
    "years_marched": [2009]
  },
  "education": {
    "major": "unknown",
    "year": "alumni"
  },
  "hometown": {
    "city": "unknown",
    "state": "unknown"
  }
}
