{
  "name": "Domino",
  "birth_certificate_name": {
    "first": "William",
    "last": "Rater"
  },
  "emoji": "ðŸŽ²",
  "marching": {
    "years_marched": [2020]
  },
  "education": {
    "major": "Political Science",
    "minor": "Environmental Science",
    "year": "freshman"
  },
  "hometown": {
    "city": "Valparaiso",
    "state": "Indiana"
  }
}
