{
  "name": "Holdoor",
  "birth_certificate_name": {
    "first": "Logan",
    "last": "Juran"
  },
  "emoji": "ðŸšª",
  "marching": {
    "years_marched": [2019, 2020],
    "shoutout": "https://www.instagram.com/p/CFH7rLWlllR/"
  },
  "education": {
    "major": "Pharmacy",
    "year": "sophomore"
  },
  "hometown": {
    "city": "Highland",
    "state": "Indiana"
  },
  "personal": {
    "hobbies": [
      "playing guitar",
      "swimming",
      "hanging out with his friends"
    ]
  }
}
