{
  "name": "Flounder",
  "birth_certificate_name": {
    "first": "Sean",
    "last": "Knickerbocker"
  },
  "emoji": "üêü",
  "marching": {
    "years_marched": [2018, 2019, 2020],
    "shoutout": "https://www.instagram.com/p/CFceFkUF2nF/"
  },
  "education": {
    "major": "Insect Biology w/ concentration in Forensic Entomology",
    "minor": "Criminal Justice and Forensics",
    "year": "junior"
  },
  "hometown": {
    "city": "Peru",
    "state": "Indiana"
  },
  "personal": {
    "hobbies": [
      "hanging out with friends"
    ]
  },
  "achievements": {
    "bottom_feeder_committee": true
  }
}
