{
  "name": "Mr. Moeschberger",
  "birth_certificate_name": {
    "first": "Mr.",
    "last": "Moeschberger"
  },
  "emoji": "üèÅ",
  "marching": {
    "years_marched": [1998, 1999, 2000, 2001, 2002],
    "shoutout": "https://www.instagram.com/p/CMutZ6ZFWb9/"
  },
  "education": {
    "major": "Social Studies Education",
    "year": "alumni"
  },
  "hometown": {
    "city": "Kokomo",
    "state": "Indiana"
  },
  "alumni": {
    "job": "Camp director and Chief Fun Officer"
  }
}
