{
  "name": "Rolex",
  "birth_certificate_name": {
    "first": "Aaron",
    "last": "Cruz"
  },
  "emoji": "‚è±",
  "marching": {
    "years_marched": [2017, 2018, 2020],
    "shoutout": "https://www.instagram.com/p/CHx9_V4lS9N/"
  },
  "education": {
    "major": "Acting/Theatre",
    "year": "senior"
  },
  "hometown": {
    "city": "Elwood",
    "state": "Indiana"
  }
}
