{
  "name": "Velveeta",
  "birth_certificate_name": {
    "first": "Reagan",
    "last": "Duffy"
  },
  "emoji": "ðŸ¤¢",
  "marching": {
    "years_marched": [2020],
    "shoutout": "https://www.instagram.com/p/CFuUEovFhD2/"
  },
  "education": {
    "major": "Actuarial Science / Statistics",
    "minor": "Economics / MGMT / Environmental Policy",
    "year": "junior"
  },
  "hometown": {
    "city": "Vero Beach",
    "state": "Florida"
  },
  "personal": {
    "hobbies": [
      "watching stand-up comedy",
      "painting"
    ]
  }
}
