{
  "name": "Reno",
  "birth_certificate_name": {
    "first": "Matthew",
    "last": "Radford"
  },
  "emoji": "",
  "marching": {
    "years_marched": [2017, 2018]
  },
  "education": {
    "major": "",
    "minor": "",
    "year": "senior"
  },
  "hometown": {
    "city": "Nashville",
    "state": "Tennessee"
  },
  "achievements": {
    "bottom_feeder_committee": true
  }
}
